Location of Webcam, webcam url
Hawaii, https://youtu.be/DY5RYp4sxYc
Santa Monica Beach, https://youtu.be/OWbI6WtlI-k
Waimea Bay Oahu Hawaii, https://youtu.be/wnNrd-VjLsQ
Galapagos Islands, https://youtu.be/1Z9Z5Z1Z1Zs
Deerfield Beach Florida USA, https://www.youtube.com/watch?v=-HAi_5IIAYg
Pacifica Pier and Beach Pacifica CA, https://www.youtube.com/watch?v=JOu_NfPRg-w
Flagler Beach Pier, https://www.youtube.com/watch?v=kYlw-B5iMy8
Ocean Village Beach Resort - MacKenzie Beach, https://www.youtube.com/watch?v=yb1oJwS0iNQ
Frying Pan Ocean Cam, https://www.youtube.com/watch?v=vGimsBVpuN8
Hanson Island BC Canada, https://youtu.be/f6KyNadD2zs
Dumpling Mountain Katmai National Park Alaska, https://youtu.be/r0cwB9l-zy0
Anacapa Island Cove - Channel Islands National Park, https://youtu.be/jF_2BWaGdHg
